Title,Publisher,Published,Downloads,Pages,Category
Ethics of the Abyss,Denys Spirin,26-Apr,0,113,Philosophy
The Black Flame: A Philosophy of Acausality,Denys Spirin,26-Mar,0,172,Philosophy
21 levels of Self-Deception: THIRD EDITION,Tom Wallace,26-Mar,3,206,Philosophy
Conatus: THIRD EDITION,Tom Wallace,26-Mar,2,235,Philosophy
Conatus: REVISED EDITION,Tom Wallace,26-Feb,3,297,Philosophy
Treatise on Ontology,Denys Spirin,25-Jul,27,105,Philosophy
Life In A Nutshell,Michael McNaught,25-Jul,41,55,Philosophy
Synchronic Theistic Monism,"Michael Perel, M.D.",25-Jun,6,190,Philosophy
"Ontology of Differentiation: Being, Consciousness, and the Game",Denys Spirin,25-Jun,18,380,Philosophy
Truth HQ,Tom Wallace,25-Jun,6,95,Philosophy
DYNAMISM THE KINGDOM OF HEAVEN,GEORGE MARTIN WILLIAMS,25-Jun,24,197,Philosophy
Tales From a Distant Shore: THIRD EDITION,Tom Wallace,24-Dec,26,90,Philosophy
Selected Articles: Metaphysics and Theology,John Roland Stahl,24-Jun,57,178,Philosophy
One Planet Makeover,John Roland Stahl,24-Jun,24,477,Philosophy
Veritas,Lost Herald,24-Mar,22,253,Philosophy
Stylish Transient: A Novel,DJ Rankin,24-Mar,32,218,Philosophy
Rainbow Rock,Fractalosopher,23-Jul,77,127,Philosophy
Good Christian Philosophy To Live By,Adam J. Capps,23-May,144,101,Philosophy
"Star dust, we are all connected.",Dr Martinho Correia,23-May,77,137,Philosophy
The Mind This Enigma,Dr Martinho Correia,23-May,93,155,Philosophy
Musings of a Very Strange Man,Hunter Vaughan,23-Apr,60,44,Philosophy
Rediscovering Transcendence,Martin Euser,23-Apr,144,123,Philosophy
Sci-Fi Film Fiesta The Lost Last Volume 12: Speculations & Ruminations,Chris Christopoulos,23-Mar,17,73,Philosophy
My philosophical ideas 2,Antonio Pinto Renedo,23-Mar,29,83,Philosophy
Valid Views of God?,L.M. Leteane,23-Jan,92,72,Philosophy
A Infinidade,Adolfo F. Vaz,22-Sep,11,561,Philosophy
Twenty-One Levels of Self-Deception: Revised Edition,Tom Wallace,22-Jul,130,175,Philosophy
The Dance of Life,Havelock Ellis,21-Jul,287,382,Philosophy
Patriarchs and Prophets,Ellen G. White,21-May,152,521,Philosophy
Resonance with the Self,Martin Euser,21-May,820,124,Philosophy
Acquaintance with natural numberology,Wang Mo,21-Jan,229,35,Philosophy
100 Diamond Quotes,AiR-Atman in Ravi,20-Nov,383,132,Philosophy
A Pictorial Key to the Tarot,A.E. Waite,20-Oct,336,171,Philosophy
But We Pray,AiR-Atman in Ravi,20-Jul,348,168,Philosophy
FEAR,AiR-Atman in Ravi,20-Apr,867,246,Philosophy
The End Of Philosophy - Tales Of Reality,Jan Strepanov,20-Mar,1166,202,Philosophy
Human Being,Selvam Sivakumar,20-Mar,559,50,Philosophy
Atheden,Wendell Charles NeSmith,20-Feb,119,118,Philosophy
Unavoidable: a Hard Truth about Alien Encounters,John Erik Ege,20-Jan,277,106,Philosophy
Why Bad Things Can’t Happen To Good People!,AiR-Atman in Ravi,19-Nov,1045,117,Philosophy
"The Ultimate Goal of Life – MEN – Moksha, Enlightenment, Nirvana",AiR-Atman in Ravi,19-Nov,343,166,Philosophy
The arrival of the extraterrestrials,Antonio Pinto Renedo,19-Oct,213,32,Philosophy
The True Meaning of Yoga,AiR-Atman in Ravi,19-Oct,541,96,Philosophy
How God Created the Universe,W A Dunkley,19-Sep,368,58,Philosophy
The Great Awakening,Wendell Charles NeSmith,19-Sep,333,99,Philosophy
Living Neverland,Wendell Charles NeSmith,19-Sep,51,137,Philosophy
Ivory Heart,Wendell Charles NeSmith,19-Sep,44,94,Philosophy
"Success is Not Happiness, Happiness is Success",AiR-Atman in Ravi,19-Jul,1143,140,Philosophy
GOD = HAPPINESS,AiR-Atman in Ravi,19-Jul,212,137,Philosophy
Suffer No More,AiR-Atman in Ravi,19-Jun,330,142,Philosophy
Questions You Must Answer Before You Die,AiR-Atman in Ravi,19-Jun,1824,162,Philosophy
Be Happy In The Now,AiR-Atman in Ravi,19-Jun,516,50,Philosophy
The Fourth Factor,AiR-Atman in Ravi,19-May,468,50,Philosophy
Who Are You & Why Are You Here?,AiR-Atman in Ravi,19-Feb,345,145,Philosophy
The A to Z of Karma,AiR-Atman in Ravi,19-Jan,1148,167,Philosophy
Why the Monk laughted Part One,Natarajan Nagarethinam,19-Jan,148,28,Philosophy
Why the Monk Laughed - Part II,Natarajan Nagarethinam,18-Dec,119,44,Philosophy
"I am not I, Who am I?",AiR-Atman in Ravi,18-Dec,685,130,Philosophy
I Will Never Die,AiR-Atman in Ravi,18-Dec,210,99,Philosophy
The Mind is a Rascal,AiR-Atman in Ravi,18-Dec,156,102,Philosophy
Death is not the End. Death is Liberation,AiR-Atman in Ravi,18-Dec,262,104,Philosophy
Three Peaks of Happiness,AiR-Atman in Ravi,18-Dec,419,174,Philosophy
Who is God? Where is God? What is God?,AiR-Atman in Ravi,18-Nov,278,150,Philosophy
My Guru,AiR-Atman in Ravi,18-Nov,52,197,Philosophy
A Cosmic Drama,AiR-Atman in Ravi,18-Nov,266,110,Philosophy
Changing Paradigm,Ken Nakamura,18-Nov,304,30,Philosophy
"Symbols, Myth and Meaning",J.J Artemis,18-Jul,1780,83,Philosophy
Words of Wisdom,Raymond Russ,18-May,1178,22,Philosophy
The Ultimate Existential Reality Answer; Vedanta; God and Science,Ravi S. Iyer,18-Apr,264,125,Philosophy
A Slice of Life: A Collection of Essays,Dr Ram Lakhan Prasad,18-Feb,402,404,Philosophy
We Are Awakening,Anita B. Sulser,17-Jun,915,108,Philosophy
The A to Z of Life Philosophy,RVM,17-Mar,936,135,Philosophy
Talaash – Discover Your True Self,AiR,16-Oct,991,210,Philosophy
Mindfulness,Amaravati,16-Sep,936,50,Philosophy
Bridges for Honest Skeptics,Joel Lantz,16-Sep,498,1002,Philosophy
Solar Powered,Kakhaber Tukhashvili,16-Aug,121,33,Philosophy
Ergonocracy - New Ideology for a Human Adapted 21st century Regime,Jorge Alves,16-Aug,351,423,Philosophy
Nations are Men! Men are Nations!,Richard Shekari,16-Jul,145,44,Philosophy
The Key,Relenski Zortac,16-Jul,1686,232,Philosophy
Karmasutra-Cracking the Karmic Code,Hingori,16-Jun,577,139,Philosophy
Aatmasutra-Unveiling the Soul,Hingori,16-Jun,570,254,Philosophy
The Salvation  of Love And Love as Salvation,Laurence Robert Cohen,16-Apr,534,98,Philosophy
Heartfulness Magazine Issue 6,Sahaj Marg Spirituality Foundation,16-Mar,182,84,Philosophy
60 Reflections of Daily Philosophy to Get By,Raquel Couto Antelo,16-Feb,1185,127,Philosophy
Light: Philosophy,Ankur Mutreja,16-Jan,284,48,Philosophy
Spirituality,Eric EH Buddhadharma,16-Jan,509,10,Philosophy
Life Lessons from Grandpa and His Chicken Coop: A Playful Journey Through Some Serious Sh*t,Jacob Paul Patchen,15-Nov,1276,106,Philosophy
I Don't Know,Philip E. Graves,15-Oct,335,190,Philosophy
Cosmology,ALEXIS KARPOUZOS,15-Sep,569,57,Philosophy
Illusions - Maya,Natarajan Nagarethinam,15-Sep,445,82,Philosophy
Software and Mind: The Mechanistic Myth and Its Consequences,Andrei Sorin,15-May,1262,50,Philosophy
The Self-Criticism of Science,ALEXIS KARPOUZOS,15-Apr,362,27,Philosophy
ஓட்டங்கள்  (Spirituality Through Eyes of Science),Natarajan Nagarethinam,15-Jan,310,185,Philosophy
Tip Toe In The Briar Patch,Wade Welch,14-Oct,104,51,Philosophy
Selected African Proverbs From the Igbo people of Eastern Nigeria,Uzoma Azuonye,14-Jul,675,56,Philosophy
Les Origines Des Eaux De Source Dans Le Monde,Mohammad Amin Sheikho,14-May,44,141,Philosophy
The Most Important Knowledge You Would Ever Read Implement and Live up to Forever,Andy PSV,14-Mar,2263,554,Philosophy
Tell the Truth,Robert Velarosa,14-Mar,867,92,Philosophy
Proclus Diadochus on the Theology of Plato,Thomas Taylor,13-Dec,402,593,Philosophy
Forall X: An Introduction to Formal Logic,P. D. Magnus,13-Nov,711,160,Philosophy
The Sources of Spring Water in the World,Mohammad Amin Sheikho,13-Nov,304,120,Philosophy
In Medusa's Mirror,Maïa,13-Jul,464,145,Philosophy
"First Person Plural, Imperfect",Maia,13-Jul,704,246,Philosophy
In Whose Name?,Maïa,13-Jun,494,121,Philosophy
Introduction to Phenomenology,Dermot Moran,13-Mar,2252,616,Philosophy
Little Book Open - Securing a Narrow Clear Passage to the Future,David Butterworth,13-Feb,956,399,Philosophy
The Silent Whisperings Of The Heart,Swami Dhyan Giten,13-Jan,1228,56,Philosophy
The Psychic Thinker,Geoff Howard,12-Nov,986,52,Philosophy
Life in Two Worlds,Gerhard Nehls,12-Sep,791,102,Philosophy
Game of Life: The Fifth Flower,Asger Rosendal Thorn,12-Aug,1829,144,Philosophy
Thought Relics,Rabindranath Tagore,12-Aug,152,50,Philosophy
The Works,Tiago Bonacho,12-Jul,341,50,Philosophy
Altar of Peace,Tiago Bonacho,12-Jul,640,50,Philosophy
The Hidden Truth:  A Logical Path -  to Discover the Nature of Reality and the Meaning of Life,Wade C. Wilson,12-May,3590,148,Philosophy
"Our Holy Hell: The Causes, the Solutions",Aron Loyd,11-Dec,2508,389,Philosophy
Rayisms,Ray Rothbard,11-Nov,1528,28,Philosophy
Homo Sapience Joseph II,Joseph,11-Aug,1530,92,Philosophy
Talking AZA 1,Eugene Halliday,11-Aug,1845,28,Philosophy
Home Sweet Hell,Wade Welch,11-Aug,1380,21,Philosophy
Not Communication,Marc Burock,11-Jul,1776,96,Philosophy
Act of Giving,Wade Welch,11-Jul,3656,20,Philosophy
Maxims of Wisdom of Ancient Greece,John Kyriazoglou,11-Jul,3966,39,Philosophy
Deal or No Deal; The True Meaning of Life,Wade Welch,11-Jul,7821,25,Philosophy
Tomorrow's Science Today,Rodney Bartlett,11-Apr,9706,112,Philosophy
Will? I Am! : my Theory of Everythink,William,11-Mar,6644,75,Philosophy
Mystic Road,John Ivan Coby,11-Mar,3821,152,Philosophy
An Immortal Soul or an  Immortal Spirit - are  Both Immortal?,William West,11-Jan,10768,188,Philosophy
Beyond the Word: An Awakening,Elizabeth Hugate Hudgins,10-Nov,11441,336,Philosophy
Thoughts and Reflections,MVR Vidyasagar,10-Oct,51029,86,Philosophy
Earth Friendly Planet,Community Press,10-Oct,16493,63,Philosophy
ALICE HICKEY: Between Worlds,justin spring,10-Aug,22558,245,Philosophy
Secrets of the Mind,Len Berg,10-Aug,24511,119,Philosophy
Common Sense,Thomas Paine,10-Aug,31484,42,Philosophy
Focus - The Key to Success,CBTopSites,10-Aug,15996,16,Philosophy
My Choice to Abuse Drugs,Erekose,10-Aug,7515,44,Philosophy
Message of the Perfect World,Sanju Paison,10-Aug,6036,54,Philosophy
The Rights of Man,Thomas Paine,10-Aug,19713,180,Philosophy
The Art of Money - Getting or Golden Rules for Making Money,P.T. Barnum,10-Aug,5359,30,Philosophy
Divine Dews,Shakti Prasad Palo,10-Aug,3352,22,Philosophy
She Will Strike Back,N. B. Gore,10-Aug,2577,4,Philosophy
Maria or the Wrongs of Woman,Mary Wollstonecraft,10-Aug,11415,86,Philosophy
Personality Development,Alok Kumar Dubey,10-Aug,21318,11,Philosophy
Tame Your Brain,Jan Tincher,10-Aug,10043,27,Philosophy
70 of the Most Motivational Quotes Ever,Matthew Roberts,10-Aug,52040,10,Philosophy
Philosophy of Life and Other Essays,B.J. Gupta,10-Aug,11277,35,Philosophy
Codex Veritas Neo: The New Vision For a New Reality,Neo,10-Aug,8213,71,Philosophy
The Masters and the Path,C.W. Leadbeater,10-Aug,9587,251,Philosophy
Press 1 for Pig Latin,Robert S. Swiatek,10-Aug,7418,213,Philosophy
The Ten Dirty Secrets of Getting Enlightened,M.G.,10-Aug,6929,19,Philosophy
Finishing the Mysteries of Gods and Symbols,Seven Star Hand,10-Jul,27421,241,Philosophy
God's a Trip!,Jay M. Horne,10-May,14781,161,Philosophy
This Page Intentionally Left Blank -Just Like the Paychecks of the Workers,Robert S. Swiatek,10-Mar,8353,189,Philosophy
"Tick Tock, Don't Stop - A Manual for Workaholics",Robert S. Swiatek,10-Mar,6540,164,Philosophy
Falsehood: An Analysis of Illusion's Singularity,Marc Burock,9-Dec,5472,77,Philosophy
A New Earth and A New Universe,Rodney Bartlett,9-Sep,34738,125,Philosophy
The Books Of God,Ron Cash,25-Jan,57,242,History
Egyptian History,Amir masood,25-Jan,61,58,History
US Truths and Remedies,John C. Dean,24-May,150,87,History
The Cover-up General,Edwin Giltay,24-Apr,86,286,History
Guardians of Faith: The Hospitaller Order of St. Thomas of Acon,James K. Cater,24-Jan,41,92,History
PAST VOICES,Ian Matsuda,24-Jan,24,32,History
Celebrating New Beginnings: Global Traditions of the New Year.,Shalna Omaye,23-Dec,26,67,History
"THE HISTORY OF ALBINISM IN AFRICA-  Myths, Legends, and Superstitions",Benaiah Orajereyor Agejivwie,23-Jul,88,66,History
Jallikattu Jaathikattu (Tamil Edition),Adhi Asuran,23-May,10,90,History
JFK Assassination The Last Book,John C. Dean,23-Jan,264,89,History
Age of Bronze History Magazine vol.1,Maxim Ferapontov,22-Oct,120,50,History
Pelts and Palisades: The Story of Fur and the Rivalry for Pelts in Early America,Nathaniel C. Hale,22-Aug,116,288,History
Land Without Chimneys,Alfred Oscar Coffin,22-Aug,25,326,History
De teleurgang van het Ottomaanse Rijk,Jean Pierre Van Rossem,22-Aug,16,28,History
French Life in Town and Country,Hannah Lynch,22-Aug,86,251,History
Right and Wrong in Massachusetts,Maria Weston Chapman,22-Aug,28,137,History
The Story of Abraham Lincoln,Mary Agnes Hamilton,22-Jul,177,92,History
Dragons and Cherry Blossoms,Mrs. Robert C. Morris,22-Jul,50,124,History
Twenty Years at Sea: Leaves from my old log-books,Frederic Stanhope Hill,22-Jul,48,193,History
Under the German Shells,Emmanuel Bourcier,22-Jul,62,146,History
The Mexican War Diary of George B. McClellan,George B. McClellan,22-Jul,36,71,History
The book of the Ancient Greeks,Dorothy Mills,22-Jul,161,383,History
Es war nicht Bubenberg!,Michael Gauger,22-Jun,8,21,History
Friendly counsels for freedmen,J. B. Waterbury,22-Jun,24,25,History
"The Lenni Lenape, or Delaware Indians",Edwin Robert Walker,22-Jun,33,34,History
Old Indian trails,Walter McClintock,22-May,68,398,History
The American Navy,French Ensor Chadwick,22-May,32,221,History
Life of Her Majesty Queen Victoria,Dame Millicent Garrett Fawcett,22-May,70,276,History
Bring the Jubilee,Ward Moore,22-May,77,263,History
Forty Years of It,Brand Whitlock,22-May,66,383,History
The Druidess: A Story for Boys and Others,Florence Gay,22-May,27,149,History
Peru: A land of contrast,Millicent Todd Bingham,22-Apr,50,226,History
First Theater in America,Charles P. Daly,22-Apr,23,120,History
Mandalay to Momien,John Anderson,22-Apr,26,418,History
Stories from the Crusades,Janet Harvey Kelman,22-Apr,134,76,History
Ancient Archers,Lonnie Goff,22-Apr,55,50,History
The Lone Swallows,Henry Williamson,22-Apr,20,153,History
The Truth About Congo Free State,F. Starr,22-Apr,65,122,History
Through Colonial Doorways,Anne Hollingsworth Wharton,22-Apr,34,155,History
The Mirror of the Graces,Unknown,22-Apr,45,158,History
The River of London,Hilaire Belloc,22-Apr,28,92,History
Winchester Painted,Telford Varley,22-Apr,17,201,History
The Irish Nuns at Ypres: An Episode of the War,Dame M. Columban,22-Apr,31,142,History
The Native Races of East Africa,Wilfrid D. Hambly,22-Apr,52,53,History
Peaks of Shala,Rose Wilder Lane,22-Apr,19,334,History
White Mountain Trails,Winthrop Packard,22-Apr,42,218,History
News from No Man's Land,James Green,22-Apr,87,83,History
Father Thames,Walter Higgins,22-Apr,19,261,History
Famous Colonial Houses,Paul M. Hollister,22-Mar,50,172,History
Africa and the American Flag,Andrew H. Foote,22-Mar,48,328,History
The Native Races of British North America,Wilfrid D. Hambly,22-Mar,50,63,History
The Two Dianas:  Volume 3,ALEXANDRE DUMAS,22-Mar,30,410,History
The Two Dianas:  Volume 2,ALEXANDRE DUMAS,22-Mar,30,442,History
The Two Dianas:  Volume 1,ALEXANDRE DUMAS,22-Mar,39,431,History
Woman in the Golden Ages,Amelia Gere Mason,22-Mar,71,321,History
"Cavalry Curt: Or, The Wizard Scout of the Army",George Waldo Browne,22-Feb,60,122,History
Origins of the Celts,Cryfris Llydaweg,22-Feb,209,76,History
A Gringo in Mañana-Land,Harry L. Foster,22-Feb,25,345,History
Sidelights on Negro Soldiers,Charles H. Williams,22-Jan,103,211,History
The Moon: A Popular Treatise,Garrett Putman Serviss,21-Dec,45,209,History
Historical Characters in the Reign of Queen Anne,Mrs. Oliphant,21-Dec,97,237,History
The Passing of Morocco,Frederick F. Moore,21-Nov,53,121,History
"The Makers of Modern Rome, in Four Books",Mrs. Oliphant,21-Nov,77,630,History
Vicksburg,J. Frank Hanly,21-Nov,28,16,History
Inside the Russian Revolution,Rheta Childe Dorr,21-Nov,130,226,History
A Soldier’s Diary,Ralph Scott,21-Nov,126,105,History
Rasputin and the Russian Revolution,Princess Catherine Radziwill,21-Nov,99,283,History
The Valley of Democracy,Meredith Nicholson,21-Nov,55,241,History
"The Chronicles of Enguerrand de Monstrelet, Vol. 8 [of 13]",Monstrelet,21-Oct,20,316,History
"The Chronicles of Enguerrand de Monstrelet, Vol. 7 [of 13]",Monstrelet,21-Oct,16,315,History
"The Chronicles of Enguerrand de Monstrelet, Vol. 6 [of 13]",Monstrelet,21-Oct,19,312,History
Tunisia Campaign with drawings by Carol Johnson,Richard Clarke,21-Oct,48,59,History
The Book of Gallant Vagabonds,Henry Beston,21-Oct,27,148,History
South Africa; vol II.,Anthony Trollope,21-Oct,54,294,History
South Africa; vol I.,Anthony Trollope,21-Oct,74,313,History
The History of the Peloponnesian War,Thucydides,21-Oct,69,655,History
The Whole Truth and Nothing But,James Brough and Hedda Hopper,21-Oct,26,446,History
Lucian's True History,of Samosata Lucian,21-Oct,73,80,History
"The Story of Rome, From the Earliest Times to the Death of Augustus, Told to Boys and Girls",Mary Macgregor,21-Oct,89,552,History
"The Story of the Sun: New York, 1833-1918",Frank Michael O'Brien,21-Oct,16,474,History
Wood Wanderings,Winthrop Packard,21-Sep,45,98,History
Woodland Paths,Winthrop Packard,21-Sep,48,128,History
Wildwood Ways,Winthrop Packard,21-Sep,52,112,History
The Seven Lively Arts,Gilbert Seldes,21-Sep,88,339,History
The Tangled Skein,Baroness Orczy,21-Sep,40,370,History
A Sheaf of Bluebells,Baroness Orczy,21-Sep,31,416,History
Pimpernel and Rosemary,Baroness Orczy,21-Sep,39,418,History
The Noble Rogue,Baroness Orczy,21-Sep,40,478,History
The Cat at Light's End,Charlie Dickinson,21-Aug,58,186,History
Playing with Fire: A Story of the Soudan War,James Grant,21-Aug,66,504,History
"Jill, Vol. 2",E. A. Dillwyn,21-Jul,18,171,History
"Jill, Vol. 1",E. A. Dillwyn,21-Jul,21,177,History
Magic London,Netta Syrett,21-Jul,70,221,History
In the Beginning,Ellen G. White,21-May,183,521,History
From Here to Forever,Ellen G. White,21-May,72,458,History
The Nagorno-Karabakh Conflict Between Armenia and Azerbaijan the Roots of Problem and Prospects for a Settlement,Ramiz Mehdiyev,20-Jun,143,60,History
Pogroms And Other Atrocities,Bassam  Imam,20-May,471,89,History
Bible Of The Freeborn American Patriot Book 2,H.L. Dowless,20-Mar,295,285,History
Bible Of The Freeborn American Patriot,H.L. Dowless,20-Mar,556,167,History
The Path of Splitness,Indrek Pringi,20-Feb,828,2771,History
Sports Scandals and Crimes in the United States (selected cases),Michael Erbschloe,19-Aug,262,55,History
The Ugliness of White Supremacy Extremists: Field Notes from 2019,Michael Erbschloe,19-Aug,326,55,History
Modern Cases of Espionage in the United States (1975 – 2008),Michael Erbschloe,19-Aug,573,85,History
Office of the Inspector General: Review of Seven Offices,Michael Erbschloe,19-Jul,48,54,History
"Mount Olympus Ancient Sites, Museums, Monasteries and Churches",Jürgen Weidner,19-May,298,50,History
Wolseley Anzacs,Ben Matthews,19-Mar,289,80,History
Reclaiming the Spoils of Annwfyn: Regia Altera and the landscape of the Mabinogi,Gerard Beggan,19-Mar,80,86,History
The Butterfield Trail Through The Concho Valley and West Texas,Tom Ashmore,19-Jan,324,150,History
"Merrymeeting Forge, Gwennap, UK  - a History",Leonard Szepietowski,18-Aug,124,74,History
The Outstanding Success of the U.S. Securities and Exchange Commission,Michael Erbschloe,18-Feb,264,116,History
Nasty Stuff About North Korea,Michael Erbschloe,18-Feb,871,52,History
Nasty Stuff About Russia,Michael Erbschloe,18-Feb,596,54,History
Trail of Poppies,Phil Brotherton,18-Jan,859,220,History
The Dowager Highlander,Hugh Frazer,17-Aug,242,76,History
U.S. Military Educational Institutions,Michael Erbschloe,17-Feb,448,62,History
Brief Histories of U.S. Government Agencies Volume Five,Michael Erbschloe,17-Feb,357,97,History
Brief Histories of U.S. Government Agencies Volume Four,Michael Erbschloe,17-Feb,254,84,History
Brief Histories of U.S. Government Agencies Volume Three,Michael Erbschloe,17-Feb,261,101,History
Brief Histories of U.S. Government Agencies Volume Two,Michael Erbschloe,17-Feb,360,117,History
Brief Histories of U.S. Government Agencies Volume One,Michael Erbschloe,17-Feb,621,111,History
Naval Warfare in World War Two,Bill Brady,16-Dec,1942,256,History
Victim Zero: The Internet Bullying of Monica Lewinsky,Michael Erbschloe,16-Oct,497,74,History
101 Arabian Hours,Terry J. Walters,16-Oct,388,124,History
US Pacific Victory in World War Two,Bill Brady,16-Sep,1398,155,History
Thinking Leadership in Africa,Allan Bukusi,16-Aug,1078,139,History
Commanders of World War Two,Bill Brady,16-Jun,2049,217,History
Nutuk (Turkish Edition),Mustafa Kemal Ataturk,16-Jun,253,614,History
Aramaic and Hebrew the Languages Spoken in 1st Century CE Judea,Camilo Ezagui Menashe,16-Mar,945,28,History
The Wars for the Silk Roads,Iakovos Alhadeff,16-Feb,1939,59,History
"A History of Limmer -Person, Place and Thing",Brian E. R. Limmer,15-Dec,162,306,History
21 Manfaat Belajar Sejarah,Hanif Amin,15-Dec,67,21,History
Authentic Nguni Peoples HIstory,KE Hlongwane,15-Nov,431,252,History
The Guns of Tomaree,Joseph Michael Smith,15-Jul,168,38,History
Koonorigan,Joseph  Michael Smith,15-Jul,154,57,History
The First World War for Oil 1914-1918,Iakovos Alhadeff,15-Jun,2125,39,History
The Forgotten People & Company,Henry Smith,15-Jun,349,60,History
Hindu Rites of Passage: A Historical Overview,Jayanta Bhattacharya,15-May,558,248,History
Texas Petroleum: The Unconventional History,Mike Cox,15-Apr,906,298,History
Historic Frederick County: The Story of Frederick & Frederick County,Christopher N. Butler,15-Apr,157,98,History
Oneida County: An Illustrated History,Oneida County Historical Society,15-Mar,136,146,History
Historic Columbus: A Bicentennial History,Ed Lentz,15-Mar,215,202,History
The Swamp of Despair,Dumitru Bordeianu,15-Jan,904,898,History
Sejarah Ringkas Kesusastraan Indonesia,Muhri,15-Jan,246,73,History
Alb pe Alb,Eugenia Bogdan,14-Dec,66,160,History
Did You Know?,David Barrow,14-Nov,4291,124,History
Incredible & Crazy Stories From History,David Barrow,14-Nov,7347,165,History
Lessons in Non-violent Civil Disobedience from the life of M. K. Gandhi and his Legacy,Arun J. Mehta,14-Nov,1380,186,History
Fort Collins at 150: A Sesquicentennial History,Wayne Sundberg,14-Nov,192,246,History
Under Three Flags in Cuba,Adrian Musgrave,14-Oct,440,106,History
To Kumassi with Scott,Adrian Musgrave,14-Oct,261,101,History
Medieval Today,Arcaeditora,14-Aug,134,235,History
The Art of War,Sun Tzu (original),14-Apr,5460,34,History
Presidents' Body Counts: The Twelve Worst and Four Best American Presidents,Al Carroll,14-Mar,1347,511,History
Making Peace After Genocide,Howard Wolpe,14-Feb,205,80,History
Profiles in Leadership,Central Intelligence Agency,14-Feb,535,61,History
Trouthe is the Highest Thing,Robert B. Waltz,14-Jan,231,85,History
King Alfred's Viking,Charles W. Whistler,14-Jan,1157,139,History
The Story of the Greeks,H. A. Guerber,14-Jan,1173,101,History
The Story of Geographical Discovery: How the World Became Known,Joseph Jacobs,13-Dec,1101,83,History
Peter Parley's Tales about America and Australia,Samuel Griswold Goodrich,13-Dec,373,90,History
Outline of US History,U.S. Department of State,13-Dec,2268,380,History
Historical World Atlas,Patrick K. O'brien,13-Dec,1333,312,History
USA Literature in Brief,Kathryn Vanspanckeren,13-Dec,256,56,History
Historians on America,"Doug Linder, Carl F. Kaestle, et al",13-Dec,303,92,History
The Long March of Progress,Mahmood Hasan Khan,13-Oct,1628,576,History
Prospects to Prosperity: The Story of Oklahoma's Oil & Gas Industry,Bob Burke and Eric Dabney,13-Oct,319,358,History
King Tut,Egyking,13-Aug,2038,18,History
The Gest of Robyn Hode: A Critical and Textual Commentary,Robert B. Waltz,13-May,3448,617,History
The Minnesota Heritage Songbook,Robert B. Waltz,13-May,151,82,History
The Bible in History,Robert B. Waltz,13-Apr,6359,638,History
Treason: The Violation of Trust,Janet Hudgins,12-Nov,1884,245,History
The exploration of the world (1882),Jules Verne,12-Aug,462,50,History
Sephardic Farewell/Ancestors,Joseph Hobesh,12-Jul,2815,50,History
"When You Ride Alone, You Ride With Hitler!",Bill Edwards,12-Apr,2924,35,History
God of Hunger,John Coutouvidis,12-Jan,4735,208,History
The Intent,Jurgen Beck,11-Nov,3271,161,History
The White Company,Sir Arthur Conan Doyle,11-Oct,9316,50,History
Silence of a Soldier,William J. Duggan,11-Sep,9472,43,History
La Fase Oculta de la Guerra Civil en Costa Rica,Jacobo Schifter,11-Jul,316,151,History
Hitler en Centroamérica,Jacobo Schifter,11-Jun,4199,274,History
Hitler in Central America,Jacobo Schifter,11-Jun,42453,281,History
The United States Coast Guard 1790 to the Present - A History,Thomas P. Ostrom,11-Mar,8910,133,History
The United States Coast Guard on the Great Lakes,Thomas P. Ostrom,11-Mar,7730,98,History
Betty Zane,Zane Grey,10-Aug,27261,214,History
The Spirit of the Border,Zane Grey,10-Aug,16740,214,History
My Life in Paris,Anna Belle,10-Aug,14355,3,History
Sovereignty over the Paracel and Spratly Islands,Monique Chemillier-Gendreau,10-Aug,11751,249,History
Over the Top with the Third Australian Division,G. P. Cuttriss,10-Aug,8931,53,History
The Retro Express,Jack Joseph de Roco,10-Mar,11928,39,History
Learning To Walk - A Soldier's Story,Clifford Beck,26-Mar,0,239,Drama
The Blackfire Protocol,Clifford Beck,26-Mar,0,228,Drama
"The Bayou Sisters Saga: A Story of Love, Corporate Evil, and the Extraordinaire Bayou Family",Andre Michael Pietroschek,26-Feb,3,65,Drama
Netenyahu of the 16th Century,The Protected by Allah,26-Feb,3,286,Drama
Who's Watching Who?,Edward Drobinski,26-Jan,11,372,Drama
The Cain In The Field,Martin Francom,25-Dec,29,420,Drama
The Bureau of Dreams to be Continued,Edward Drobinski,25-Nov,8,771,Drama
Captive of the sea,Brandon McYntire,25-Oct,8,20,Drama
Sudetenland Tales,Edward Drobinski,25-Aug,17,615,Drama
A Bird Alone,Ericka Clay,25-Aug,17,250,Drama
