Title,Publisher,Published,Downloads,Pages,Category
Creating Sacred Space,David W. Fournier,10-Mar,8991,42,Religious
Corinthian Elders,Jack Fortenberry,10-Mar,12129,50,Religious
Influences of Destruction,Joshua Gen,10-Feb,6596,97,Religious
Stories of the Rishis,Nalini Sahay,10-Jan,5803,30,Religious
Walking With Jesus Through the Gospel of Luke,Anthony Perry,9-Nov,7142,54,Religious
The Poor House,Anthony Perry,9-Oct,13217,205,Religious
123 What are Christians Fighting For?,John Jones,9-Sep,15994,19,Religious
Promises to Our Father,Jeffrey Tad Dodson,9-Sep,3547,106,Religious
Three Days and Three Nights,Cliff Ashbridge,9-Sep,4439,11,Religious
Jesus' Book: Fear Not,Mary Rose,9-Jul,20073,106,Religious
Your Next 60 Seconds: Mastering Quick and Effective Decision Making for Positive Results,JD King,25-Oct,91,147,Business
Bussiness is Money,Kazi Rejwan Islam,25-Sep,104,46,Business
"Writing, Branding, Content Creation",Caleb Olayiwola,25-Aug,76,29,Business
Best Top Rated Digital Marketing Agency- PixelZen Digital,PixelZen Digital,25-Jun,23,22,Business
Unlocking Online Income: A Beginner's Guide to Making Money on the Internet,Donald Lewis,25-Jan,323,75,Business
Lean Six Sigma in Action: Mastering Change Management for Process Improvement,Nik Faizal,24-Nov,125,29,Business
"7 Businesses You Can Start Right Now, for Under $1000",Elisabeth Miazello,24-Jun,354,66,Business
Business Success Guide: 7 Businesses to Avoid and 4 Winning Opportunities.,Elisabeth Miazello,24-Jun,246,65,Business
The Digital Success Blueprint,Kiril Yakimenko,24-Jun,170,35,Business
100 Business Boosting Ideas for Growth & Success,James Funicello,24-Mar,325,21,Business
Shorten The Gap: Shortcuts to Success and Happiness,Mark Lack,24-Mar,404,139,Business
Running on Autopilot,"Michelle Thompson, MBA",24-Feb,49,231,Business
The Part-Time Entrepreneur: The Complete Guide To Starting Your Own Side Hustle,Michael McNaught,24-Feb,627,54,Business
so you want to become an investor,david m. giosa,24-Feb,106,33,Business
Business in faces,Oleg Krutko,23-Sep,164,211,Business
Divorce Strategies and How to be Alimony Free,A. Looking,23-Jul,70,210,Business
The Rollercoaster Ride of Entrepreneurship,Keith Orlean,23-Jul,216,45,Business
BRAVE Brand Blueprint,Grant McGaugh,23-Jun,209,32,Business
A Point of View with Grant McGaugh and Mike Kim Brand Master,Grant McGaugh,23-Jun,47,43,Business
"Ready, Set, Sell!",Jack Parr,23-May,227,29,Business
YOUR CHILDREN CAN BECOME CROREPATIS,RAJIV MEHTA,23-Apr,110,42,Business
15 Crucial Marketing Tips to Keep Your Law Firm Relevant in 2023,We Do Web,23-Apr,87,30,Business
The 400-Hour Workweek,David Vasilijevic,23-Mar,717,280,Business
More Time and More Money,Aurelius Tjin,23-Feb,493,32,Business
How I made my first million : 26 self-made millionaires reveal the secrets to their success,Nick Gardner,23-Feb,1512,203,Business
A Golden Pen,Mark Sias,22-Dec,155,167,Business
Wow One More®: Secrets to Win Big® from 13 Restaurant Leaders,Arjun Sen,22-Dec,126,222,Business
Building the Ultimate Marketing Agency: The Step-by-Step Guide to Starting or Growing a Digital Marketing Agency,Itamar Shafir,22-Dec,452,162,Business
A Good Reason to Smile: A Dentist's Guide to a Better Financial Future,Ross Brannon,22-Dec,43,205,Business
The Confident Retirement: Your Path to Financial Freedom,"Kris Flammang, AIF®",22-Dec,228,277,Business
Que es Clickbank y como ganar dinero como afiliado,Francisco Gonzalez,22-Nov,25,22,Business
Algunos secretos del marketing de afiliados - reporte,Francisco Gonzalez,22-Nov,12,21,Business
Los novatos y los blogs para comenzar a ganar dinero - reporte,Francisco Gonzalez,22-Nov,12,21,Business
YouTube Success Guide,Richard Holman,22-Nov,292,30,Business
Bitácora digital en El siglo 21 la influencia de los blogs - reporte,Francisco Gonzalez,22-Nov,6,23,Business
Como ganar dinero con los blogs el negocio del futuro2 - Reporte,Francisco Gonzalez,22-Nov,11,21,Business
Passive Income Streams Home Business Ideas For You To Make Money Online,Amit Singh,22-Oct,550,50,Business
Como ganar dinero con un blog sin gastar en promoción,Francisco Gonzalez,22-Oct,14,50,Business
THE SECRET TO SUCCESS FROM ON LINE BUSINESS,Ella Lu,22-Oct,152,45,Business
Simple Sales Systems,Amit Singh,22-Oct,140,50,Business
"5 Amazing Design Solutions To Optimze Logistics, No Matter The Volume Size!",Plexform,22-Oct,46,32,Business
How To Set Up GOOGLE+ Business Pages,Aslam Adat,22-Sep,153,27,Business
Growth Hacking 101,Layla Galarneau,22-Sep,162,56,Business
Retirement Rescue,Sal Guerrero,22-Aug,50,29,Business
TECHNIQUES FOR ONLINE MARKETING,MICHEL KETO,22-Jun,336,62,Business
Metaverse Made Simple,Archi Mackfly,22-Jun,162,60,Business
8 Steps to Financial Independence,Damodhar Mata,22-Mar,586,106,Business
The golden laws of wealth acquisition,momozar,22-Mar,339,27,Business
All I Need To Know About Success I Learned From Star Trek,Glen Henderson,22-Mar,254,86,Business
Building Wealth With Dividend Growth Stocks,Derrick C. Thomas,22-Feb,218,93,Business
WEALTH BUILDING BLUEPRINT,Amarachi Graciela Ofor,22-Feb,193,55,Business
Guide to Successful Online Freelancing,PLR raymond ichard,21-Nov,385,25,Business
Bitcoin Profit Secrets,T.K.Dissanayake,21-Nov,485,103,Business
Forex Foundry,Archi Mackfly,21-Sep,278,32,Business
Niche Market Discovery,Allan Summerfield,21-Sep,287,44,Business
Leadership? Just a state of mind.,Luis Gaspar,21-Sep,795,92,Business
The Warrior Marketer,THE Writer,21-Aug,261,127,Business
The Passage to Passive Income,Master Resale Rights(MRR),21-Jul,585,31,Business
Passive Income Streams,Carter Denton,21-Jul,347,31,Business
Blockchain Secrets,Archi Mackfly,21-Jul,734,65,Business
Making Money By Investing In Real Estate,U-PLR,21-May,922,32,Business
Profit Streams- 21 Powerful Ways to Make a Living Online,MRR,21-May,749,37,Business
Passive Income Streams - The Master Key to Wealth Creation and Financial Freedom,Angelia Griffith,21-Apr,653,60,Business
Warren Buffett Predicts the Future,Bill Murphy Jr.,21-Apr,713,104,Business
Earning Money with Facebook - Using Facebook to Turn Your Business into a Money Magnet,Angelia Griffith,21-Apr,1243,69,Business
The Power of Recurring Income Business Model,Angelia Griffith,21-Mar,378,61,Business
Affiliate Marketing Secrets- A Step-by-step Guide of Affiliate Marketing Strategy,Angelia Griffith,21-Feb,1222,71,Business
Starting Your Own Yahoo Store,Brenda Michell,21-Feb,210,31,Business
Cash Building Strategies,www.ultimatePLRFiresale.com,21-Feb,1305,31,Business
Million + 10K-real YouTube views per week,Denis Mikheev,21-Feb,576,25,Business
"Forex Nitty Gritty - Finally, a Forex Trading Course For Beginners!",Angelia Griffith,21-Feb,591,32,Business
Amazon Bestseller Genie,FABIOLA ASTUDILLO,21-Jan,256,27,Business
NOW! Fail or Thrive Excerpts for Busy Leaders,Ronald D. Sears,20-Dec,615,237,Business
Corporate Undertaker,Domenic Aversa,20-Dec,606,342,Business
Fostering Creativity And Innovation,Dr. Rashid Alleem,20-Oct,513,108,Business
Building A Personal Brand For Business,Michele Davis,20-Sep,923,58,Business
The SEWA Project Management Model,Dr. Rashid Alleem,20-Aug,363,147,Business
Tackle Your Payroll Tax Debt: Proven Strategies Every Sub-Contractor Business Owner Should Know,"Jacob Merkley, EA",20-May,172,113,Business
Financial Terms Dictionary - 100 Most Popular Financial Terms Explained,Thomas Herold,20-Feb,1627,227,Business
The Internet Ideology - From A as in Advertising to Z as in Zipcar,Massimo Moruzzi,20-Jan,701,76,Business
Street Smart® Cash Flow Accelerators,Lou Brown,19-Oct,2271,64,Business
Start And WIN With Your Own Restaurant,Bob Turner,19-Aug,915,62,Business
Ebay Seller Success Tips!,Tomo Albanese,19-Aug,1009,46,Business
Unemployed And Loving It,JD Clark,19-Jul,2505,137,Business
Maxims: A collection for work,Muel Kaptein,19-Jun,693,50,Business
7.5 Habits of Effective Networkers,Eric Mulford,19-May,1808,50,Business
A Guide to Security Guard Company Operations,Courtney W. Sparkman,19-Feb,378,134,Business
15 Questions About Online Advertising,Massimo Moruzzi,19-Feb,1051,42,Business
Home Based Businesses that Make Money,Thaddeus Winters,19-Jan,1504,89,Business
How to Start a Business in The USA,MyUSACorporation,19-Jan,647,44,Business
Managing Start Up Enterprises,Suhail Haque,18-Dec,1521,45,Business
Emerge (Vol. 2),Stephen Odum Okorie,18-Jul,2067,185,Business
Guide to a Successful Product Launch,Shane Barker,18-Jun,1062,27,Business
Ethicisms and their risks: 150 new cartoons about ethics at work,Muel Kaptein,18-May,604,153,Business
Social Media for Small Businesses,Alan Daniel,18-Mar,2338,35,Business
The Blueprint,Chris Thomason,18-Jan,1682,65,Business
Negotiating Essentials,Nicolas Meneses,17-Nov,2913,103,Business
Cash Flow Management Handbook,Mwesige Emmanuel,17-Oct,2462,21,Business
The 100 Most Popular Financial Terms Explained,Thomas M. Herold,17-Jul,2688,200,Business
My Startup Lessons,Viktor Cheng,17-Jun,2430,72,Business
Business Loans Uncovered,Enhanced Business Solutions,17-Jun,817,50,Business
A Raw Inside Look Into Social Media,Jeff Toohey,17-May,764,29,Business
LinkedIn or LinkedOut?: 107 Ways to Grow Your Business using LinkedIn,Sam Rathling (Author),17-Apr,1676,51,Business
Why Individuals Go For Self-Employment,FirstCall - We Add Value,17-Mar,991,21,Business
American Dream: Interviews with Industry-Leading Professionals,Jason Navallo,17-Mar,2023,82,Business
Creating Capital Money-Making as an Aim in Business,Frederick L. Lipman,17-Jan,616,46,Business
"Free Funny the eBook: Writing Comedy, Jokes, and Humor for Business, Public Speaking, or Just for Laughs",Greg Dean,17-Jan,1159,52,Business
"Rogue Elephant, Death By Tradition",P. Fitzgerald McKenzie,16-Nov,420,83,Business
Forex Tips from my “1/2 A Loss in 22 Trades” System,Damien Hooper,16-Nov,1438,53,Business
Seeking Civility,Catherine Mattice,16-Sep,345,27,Business
The Art of Delegation: Growing Your Business With a Virtual Assistant,Admin Slayer,16-Sep,1030,55,Business
Organisations Changing Their Performance Reviews : A Quick Guide,GroSum,16-Aug,289,27,Business
The Dot Com Moguls Handbook,Obinna Patrick,16-Aug,656,51,Business
The Art of Presenting Successfully,Pavlos Pavlides,16-Jul,1929,45,Business
Brick and Mortar Business for Newbies,Jackdiesel,16-Jul,651,42,Business
Building Your Digital Empire With Traffic Monsoon,Mwansa Chilekwa,16-Jul,480,53,Business
"Bid to Win: A Guide to Pursuit, Capture, and Management of Unprecedented or High Technology Projects",Evin Stump,16-Jun,340,199,Business
"The Proverbs on Wealth, Wisdom, Household and Business",Ryan M. Marks,16-Jun,1012,28,Business
Time Management and Productivity,Ken Seaney,16-Jun,2389,53,Business
Social Media Marketing,Dick Polipnick,16-Jun,1773,21,Business
The 7 Tips To Be Limitless,Sequoyah Sanders,16-May,951,25,Business
Free Traffic Tsunami - Amazing Traffic Methods You Need To Use In Your Marketing,Christoffer Gullin,16-May,627,42,Business
Systemize Your Business,Rafael D' Jesus Ferreras Castillo,16-May,1115,46,Business
5 KRA for Performance Appraisals to Make it Effective,GroSum,16-May,262,21,Business
15 Best Questions For Effective Employee Evaluation,GroSum,16-May,674,41,Business
Getting Paid for Your Opinion,Amy Nielsen,16-May,578,24,Business
How to Make a Living From Home Anywhere in the World,Johnathan Robinson,16-May,1027,21,Business
Residual Income for Morons,Dave Penman,16-May,1046,17,Business
Railroad Ties to Efficient Logistics,MCS Logistics,16-May,129,7,Business
Stop Taking All My Money,David M. Giosa,16-Apr,279,117,Business
Web Money,Amin B. Nagpure,16-Apr,502,132,Business
6 Ideas To Make Money,Sandra Summers,16-Apr,1865,21,Business
Affiliate Marketing in 2016 Made Easy - Anyone Can Succeed With This Method,Howard Lynch,16-Apr,1033,53,Business
Instant Cash Strategies,Maik Sittig,16-Mar,638,40,Business
How to Get Free Autoresponder,Pascale Moreau,16-Mar,324,24,Business
Ultimate Online Selling Machine,Sandra Summers,16-Mar,1096,24,Business
Dana Sibilsky's Tips to Successful and Profitable Blogging,Dana Sibilsky,16-Mar,300,52,Business
20+ Ways To Make A Living Online,Smartpreneur Academy,16-Mar,1174,50,Business
Be a Moneymaker,Arshad Aubeeluck,16-Mar,767,99,Business
Profit Maximizing Handbook,Rafael D' Jesus Ferreras Castillo,16-Mar,490,45,Business
Credit Score Booster,Nick Allan,16-Mar,202,59,Business
Make Money Online In 14 Days Flat - Magic Formula For Success,Sandra Summers,16-Mar,3123,25,Business
10 Traits of Successful Entrepreneurs,Kevin Sudbury,16-Mar,1377,24,Business
The Idaho Accident Book,Matthew J. Hansen,16-Feb,88,52,Business
"Cash in on the Tee Spring Craze, a Crash Course for Beginners on Starting a Highly Lucrative T-Shirt Business Online",Terry D. Clark,16-Feb,451,62,Business
A Real Easy Step by Step Beginners Guide How to Make Money with Google Adsense,Terry D. Clark,16-Jan,970,51,Business
How to Make Your Business Succeed and Dominate the Social Media World with Marketing Strategy,Terry D. Clark,16-Jan,1052,47,Business
Conversation Skills: For The Ultimate Professional,Dan Blaze,16-Jan,2195,23,Business
Day Trading the Financial Markets,Jason Berry - Day Trade Toronto,16-Jan,1903,36,Business
A Practical Guide to Best Practice for Business-to-Business (B2B) Customer Satisfaction Surveys,John Coldwell & Howard Plomann,16-Jan,358,68,Business
From Startup to Scaleup,Russell Streeter,15-Dec,1538,63,Business
Introduction to Basic Accounting,Tarannum  Khatri,15-Dec,1626,34,Business
How to Build Your First Email List in Only 3 Days,Mike Mercadante,15-Dec,978,21,Business
Grow Your Business in 90 Days or Less,Kimberly Brewer,15-Dec,1185,54,Business
Selling Digital Products and Online Profit for Beginners,Ryan Chowldh,15-Nov,1206,52,Business
5 Steps To Ensure Compliance With The FCRA,Crimcheck,15-Nov,129,22,Business
Google Sniper System with Review,George Brown,15-Nov,283,39,Business
ZipBooks,ZipBooks,15-Oct,147,23,Business
Mass Influence - The Habits of the Highly Influential,Teresa de Grosbois,15-Oct,2072,101,Business
How To Make Money Online,Gopal Singh,15-Oct,1706,22,Business
What to Why,Jamie Schneiderman and Donald Cowper,15-Oct,1156,54,Business
Understanding The Myths Of Market Trends And Patterns,Forextrendy,15-Oct,627,31,Business
Financial Inclusion in Russia,National Agency for Financial Studies,15-Oct,97,134,Business
Affiliate Marketers Handbook,Hilton Recardo Izak Hartnick,15-Sep,531,39,Business
Mindfulness for Financial Traders: An Introduction,Aedie Caltern,15-Aug,623,47,Business
Easy Social Networking For Business,Lee Werrell,15-Aug,1403,64,Business
Real Estate - Breaking Bad How to Flip Decaying Real Estate Properties for Profit,Helena Negru,15-Aug,679,42,Business
Organizing Events on a Zero Budget,Ovanes Ovanessian,15-Jul,987,62,Business
Smart Ways to Make Money,Ed Strada,15-Jul,2601,53,Business
All The Things No One Told You About Selling Security Guard Services,Courtney Sparkman,15-Jul,333,109,Business
8605 Niche Marketing Words And Phrases That Sell Like Crazy!,Larry Dotson,15-Jun,1543,155,Business
XING Erfolgreich Nutzen,Robert Nabenhauer,15-Jun,33,50,Business
Wisdom of the Markets,Andrew Dawson,15-Apr,1295,52,Business
A Guide to Starting and Running a Small Business,David Ashdown,15-Apr,5144,68,Business
77 List Building Tips,Rafael D' Jesus Ferreras Castillo,15-Apr,649,39,Business
The Millionaire’s Secret: 17 Principles of Building Wealth and Creating Multiple Sources of Passive Income,Ronald Taylor,15-Apr,3311,88,Business
Managing People in The Business World,Dr Ram Lakhan Prasad,15-Apr,2126,228,Business
Texas Petroleum: The Unconventional History,Mike Cox,15-Apr,906,298,Business
How to Live Your Passion Through Online Businesses: The $100 Plan To Change Your Life and Your Career,Brice Holmes,15-Apr,3145,128,Business
Your First Business a Starters Guide,Darren Wilkins,15-Mar,3312,25,Business
Rancid Tales,Den Warren,15-Mar,264,117,Business
How to Trade Binary Options Profitably,Joe Keane,15-Feb,1871,56,Business
Passion to Profits: How to Start a Profitable Online Business That You Love,Ron,15-Feb,1004,53,Business
"Burn, Baby, Burn! - Money & Markets Most Outrageous, Funny and Witty Quotes, Sayings and Stories",José Manuel,15-Feb,876,95,Business
Pinch Like You Mean It!  101 Ways to Spend Less Money Now,Dr. Penny Pincher,14-Dec,1373,113,Business
"Power Suit, Power Lunch, Power Failure",Lew Bayer,14-Nov,822,73,Business
75 Best Must-Have Free Apps,M L Fitz,14-Nov,1210,51,Business
The Secret is in the Journey,Scott Cundill,14-Nov,640,52,Business
Stop Losing Money and Join the Winners: Great Picks are Not Enough,Frank Neal,14-Oct,714,83,Business
Why I Can't Quit,Chibuike Wogu,14-Oct,1023,45,Business
The Can Do Entrepreneur,Chibuike Wogu,14-Oct,1801,91,Business
"Earn Extra Money,Work At Your Convenience",M Lashall Fitz,14-Oct,2862,92,Business
Home Business - The Working Guide,Idan Miro,14-Oct,899,42,Business
The Top 34 Tools for Managing Your Virtual Team,My Virtual Workforce,14-Sep,634,43,Business
From Tradesman To Businessman,Larry Maguire,14-Sep,741,51,Business
The Anatomy of Success & Failure - 7 Essential Elements that will Gurantee Radical Success in Life!,John Di Lemme,14-Sep,5226,22,Business
"The Top 10 Highly Profitable, Proven, Time-Tested Secrets to Create the Ultimate First and Last Impression with Your Cli",John Di Lemme,14-Sep,932,25,Business
Breaking The Bloggers Code: Biggest Lies In Blogging Exposed!,Andrew,14-Aug,962,24,Business
Make Money Flipping Houses While on Vacation,Jason Medley & Joe McCall,14-Aug,406,53,Business
See How Easily YOU Can Explode Your Sales!,Clifford Martinez,14-Aug,572,49,Business
Paid Surveys for Moms Dads & Teens - A Quick Guide to Making Money Taking Paid Surveys Online,M.Brown,14-Jul,530,66,Business
Forex Study Book,Austin Aims,14-Jul,984,69,Business
Earning Equilibrium,Shubham,14-Jul,331,22,Business
Attraction Marketing for Network Marketers,Erik Christian,14-Jul,1849,31,Business
Follow Up Fortunes - Secrets of email marketing revealed,Viable Marketing,14-Jul,630,31,Business
How to Quickly Get Visitors to Your Validation Landing Page,Martin,14-Jul,433,27,Business
Cash Building Strategies,Nikola,14-Jul,669,31,Business
Passive Income Game Plan,David Baer,14-Jul,1234,52,Business
You're Either a Dreamer or a Millionaire,Jake Findi,14-Jun,2634,49,Business
A Master Class in Closing Sales V1,James Xavier,14-Jun,1116,28,Business
Teacher's Guide to Making Extra Money Online,Hazel-Ann La Fortune,14-Jun,929,29,Business
How to Improve Your Credit Score For Your Real Estate Business,Ben Saylors,14-Jun,540,113,Business
PLR Money,Basid Khan,14-Jun,431,26,Business
SCRUM Body of Knowledge,SCRUMstudy / Tridibesh Satpathy,14-Jun,802,50,Business
Know Your Precious Metals Before,Simon Newcombe,14-Jun,411,34,Business
I Guarantee You Will Buy Low Sell High and Make Money,J.P. Weber,14-Jun,1661,355,Business
Rapid Income Secrets- Make Money Online Guide DA,Aaslinr,14-Jun,1010,56,Business
The Real Deal,"Alan Smith, Stephen White, and Robin Copland",14-May,713,267,Business
Your Millionaire Opportunity,Ron Taylor,14-May,2108,90,Business
Transforming De-Motivated Staff into Self-Motivated Achievers,Beyond Timelines,14-May,2231,65,Business
Righting the Enterprise - A Primer For Organizing Or Re-Organizing The Right Way,Danny G. Langdon,14-Apr,420,97,Business
Tips and How To's,Josie Lydy,14-Apr,603,30,Business
31 Days to a Better Business in 2014,Marey Hoeppner,14-Mar,825,55,Business
B2B Customer Satisfaction Surveys – a Practical Guide to Make Them Work,John Coldwell,14-Mar,334,29,Business
Introduction into Barcodes,ByteScout,14-Mar,395,48,Business
Forex Start-Up Kit For Beginners,Dan Edwards,14-Mar,2376,101,Business
Untold Story of the Survival of the Penn Central,Donald Prell,14-Mar,281,41,Business
Make Dirty Millions the Clean Way,wkirk777@aol.com,14-Feb,3215,70,Business
The Third Skillset,David Kershaw,14-Feb,1645,140,Business
Supercharged!,Isabel Wu,14-Feb,880,54,Business
Solutions for Top 50 Problems People Face with Performance Appraisals,Synergita,14-Feb,544,66,Business
The Key to Successful Branding,Agnes Mikulenaite,14-Jan,2116,61,Business
Real Estate Ain't Dead  It's a Live and Kicking! Make a Small Fortune Flipping Houses 2014,Terry Clark,14-Jan,542,78,Business
Building A Sustainable Business: A Guide to Developing a Business Plan for Farms and Rural Businesses,"Gigi Digiacomo, Robert King, et al",13-Dec,1728,289,Business
Everything You Know About Money is Wrong!,Jonah Jones,13-Nov,3329,66,Business
"Inventory Management, Spare Parts and Reliability Centred Maintenance for Production Lines",Fausto Galetto,13-Dec,666,51,Business
Environmental Waste Management in Constructions,Davorin Kralj,14-Feb,299,35,Business
Transition Parameters For Successful Reuse Business,Jasmine K.S.,13-Dec,77,37,Business
Quantitative Models for Centralised Supply Chain Coordination,"Mohamad Y. Jaber, Saeed Zolfaghari",13-Dec,430,33,Business
Home Internet Business Ideas,Octavien J. Remillard,13-Oct,1494,47,Business
Homeowners Guide - How to Survive the Worst Real Estate Market,Toni Patillo,13-Oct,363,92,Business
Workers at Home: Making the Most of Your Time,Erin Thiele,13-Sep,785,150,Business
The Manager's Guide to Workplace Health and Safety,Ravinder Tulsiani,13-Sep,1271,52,Business
365 Rules about Real Estate,Keith Marshall,13-Aug,1938,59,Business
8 Unbreakable Rules for Business,NewbizCoach,13-Jul,5618,89,Business
From the Budget to the Investment,Lucas Wiedemann,13-Jul,2344,106,Business
Grow Rich While You Sleep,Max Coles,13-Jul,1955,148,Business
Real Estate Investing: How to Find Cash Buyers and Motivated Sellers,William Johnson,13-May,2307,60,Business
6 Steps Towards Profitable Import Business,Fredrik Grönkvist,13-Mar,1444,26,Business
Facebook Marketing 2013,Jo Barnes,13-Feb,2343,94,Business
"Win on Sale, A New Perception of Sale",Christos Stilianidis,13-Feb,1033,101,Business
Performance Improvement Guide,US Coast Guard,13-Jan,1859,170,Business
Position Yourself now for the Coming Wealth Building Revolution,Dwight Chestnut,13-Jan,1456,63,Business
Before Upping the Shutters,Ravindra Kathale,12-Dec,1755,67,Business
25 Thoughts About Your Destiny for Entrepreneurs,Candi Taylor-Jeter,12-Dec,2645,50,Business
Build Your Ecommerce Step by Step,Khaled Ould Mammar,12-Nov,2118,87,Business
A Homeowner's Guide to Shortsales,Kris Lindahl,12-Nov,639,68,Business
Why Good People Sometimes do bad Things: 52 Reflections on Ethics at Work,Muel Kaptein,12-Sep,4588,203,Business
The Business Plan Workbook,Tom Hua,12-Aug,5342,63,Business
3 Paths to Internet Wealth,Robert B. Ingalls,12-Jun,9546,106,Business
Managing Business Through Human Psychology - “A Handbook for Entrepreneur”,Ashish Bhagoria,12-Jun,5320,249,Business
Do Less Work Make More Money,Leon Jay,12-Apr,13499,318,Business
Socialutions: Management Methods for the Social Era,Jay Deragon,12-Feb,2632,111,Business
The Ultimate Small Business Playbook,B2B CFO®,12-Feb,2902,75,Business
Wealth Manifestation Decoded,Olafur Olafsson,12-Jan,1531,48,Business
Unleashing the Power of Consultative Selling,Richard Grehalva,11-Dec,4739,50,Business
Kick-Ass Talent Management,Kapta Systems,11-Dec,1900,62,Business
1-to-40 Tried and Trusted Ways to Become More Productive at Work,Rough Guider,11-Nov,27405,23,Business
When Johnny Comes Marching (Homeless),Ken Smith,11-Oct,2736,177,Business
Make Million from Your Business,Dr. Tom McKaskill,11-Jul,2429,118,Business
Are Your Employees Stealing From You?,B2B CFO,11-Jul,3673,26,Business
How to Become a Wealthy Investor - Listen to the Stock Market and it Will Tell you What to Do,Sydney Tremayne,11-Mar,18257,50,Business
Adventures in Global Selling,Gayle Hickok and Bill Wilson,11-Mar,7194,192,Business
Top 25 Online Businesses for Moms,Alycia Cheatham,11-Mar,5114,50,Business
"Ideas: 101 Great Ideas for Increasing Your Visibility, Credibility and Profitability",Matt Schoenherr,11-Feb,6820,108,Business
Your Home Business (Extremely Useful Guide for Newbies),Hans Norgaard,11-Jan,7688,56,Business
7 Steps to Instant Viral Income Online,Alex  Malave,11-Jan,6729,35,Business
Home Business Models Exposed,Pepinfo,10-Dec,4770,52,Business
Sons in the Shadow: Surviving the Family Business as an SOB (Son of the Boss),Roy H. Park Jr.,10-Dec,11284,50,Business
Real Estate Investing Strategy for Rehabs,Renee Stein,10-Dec,3857,50,Business
Get Customers from the Internet For Free,Richard Mathiason,10-Dec,5109,65,Business
Are You Sinking Your Business,Jim Eastman,10-Nov,4204,50,Business
The Newbie's Online Marketing Manifesto,Mark Aylward,10-Oct,2168,35,Business
Invest to Exit,Dr. Tom McKaskill,10-Oct,7856,281,Business
10 Cash Flow Strategies for a Successful Business,Scott Richards,10-Oct,43254,18,Business
Goodwill - The Most Valuable of Business Assets,John Marchant,10-Sep,8424,14,Business
The MBA System: Your Guide to Absolute Internet Wealth,Justin Hart,10-Aug,3993,18,Business
Cashing in With Private,Avi Srivastava,10-Aug,773,23,Business
7 Popular Questions on Resale Rights Answered,Avi Srivastava,10-Aug,6592,19,Business
Fractional Home Conversion: A Summary Guide for Sellers,Daniel G. Morton,10-Aug,6720,70,Business
Why Writing Your own Information Website is the Very Best way to Make Money Online,Rebecca Matter,10-Aug,5315,14,Business
30 Tips to Maximum,Avi Srivastava,10-Aug,587,24,Business
Real Estate Secrets Exposed,Troy Swezey,10-Aug,7121,38,Business
Home Based Business Advice to Help You Start Your Own Business!,Michele Miller,10-Aug,9342,23,Business
From Ebay Zero to Hero,Mike Enos,10-Aug,23213,51,Business
The Three (3) Vital Steps to KickStart Your Web Business,Daniel Sudhakar,10-Aug,11312,15,Business
Buying Your First Home,Rick Lobley,10-Aug,9602,18,Business
