Title,Publisher,Published,Downloads,Pages,Category
Skin Whitening Forever Book PDF with Review,Wesley Eden Diaz,15-Nov,752,43,Health
Fat Diminisher System Book PDF with Review,Wesley Virgin,15-Nov,2791,38,Health
Baby Boomers Ready to Give Medical Marijuana a Chance,PotBotics,15-Nov,397,27,Health
How I Accidentally Became A Size 8 - An 8 Week Program To End Dieting,Jasmine Skee,15-Nov,559,22,Health
Ultimate Herpes Protocol Book PDF with Review,Melanie Addington,15-Nov,553,35,Health
Everything You Need To Know About Autism: Parent’s Guide,Neurogen,15-Oct,674,35,Health
I am Gonna Lose Weight Even If It Kills Me ~ 59 Tips on Dieting for the Right Reason,Terry D. Clark,15-Oct,416,127,Health
Are Your Dieting Strategies Killing You? REVEALED: The Dark Side of Summer Dieting,Julie Kerr,15-Oct,137,27,Health
"How To Be Healthy and Fit From Top to Bottom Mind, Body and Soul ~ Live A Life Span of 100 Years. Vol.5",Terry D. Clark,15-Oct,1264,492,Health
172 Uncommon Natural Health Herbal & Traditional Medicines ~ Relief for Severe Pain & Health Problems,Terry D. Clark,15-Oct,3323,209,Health
101 Tips That Burn Belly Fat Daily,Dr. Charles,15-Sep,3496,27,Health
The Disability Experience II,Debbie Johnson,15-Aug,217,126,Health
Weight Loss Kickstarter,Emmy,15-Jul,1019,23,Health
"Hot to Choose Orgonite, the Best Device for You - the Ultimate Guide for EMF Protection and Self Improvement",Suli,15-Jul,657,50,Health
Don't Eat Your Broccoli: The Shocking Truth,Russell Eaton,15-May,1175,63,Health
A New Therapy for Health & Energy,Richard Clark,15-May,1447,178,Health
7 Super Secrets for Vibrant Heath,Luis Quiroz Ravines,15-Apr,866,76,Health
"Get Out of Depression, Discover the Ways to a Happy Life - Natural Remedies for Depression",Esther Monica,15-Mar,1617,69,Health
It's a Skin Thing,Hanna Sillitoe,15-Mar,1065,62,Health
Breast Cancer Awareness Guide,Jamie Florian Stacy,15-Mar,539,21,Health
Toksyczna Psychologia I Psychiatria: Depresja a Samobójstwo,Jarosław Stukan,15-Feb,36,104,Health
Understanding Sexually Transmitted Diseases (STD):  A Guidebook to Better Sexual Health (Women),Dr Tan and Partners,15-Feb,290,23,Health
"Put A Halt to Your Addiction Gambling, Drugs, Food and Other Types",Terry D. Clark,15-Jan,594,52,Health
Truth About Abs,Craig,14-Dec,500,65,Health
Superfood Pleasures,Emmanuel Sarris,14-Dec,3266,55,Health
Cluster Headache ~ How to Attack Any Type of Chronic Headaches Dead Cold Before the Pain Starts ~ 99 Plus Home Remedy Ti,Terry D. Clark,14-Nov,473,96,Health
The Two Faces of Bipolar Disorder ~ What Does It Mean and How It Affect Your Personality or Someone You Love,Terry D. Clark,14-Nov,761,47,Health
You Starving Yourself 4 What? The Key to Lose Weight Is Check Your Metabolism,Terry D. Clark,14-Oct,871,100,Health
Therapies with Minerals,Pedro Neves,14-Oct,463,21,Health
10 Day Green Smoothie Cleanse,Lorraine Paige,14-Oct,2156,50,Health
The LOC - A Basic Guide to Cancer,The LOC,14-Sep,239,21,Health
Six Pack Secrets - Build Lean and Strong Muscles,Lorraine Paige,14-Sep,955,50,Health
10 Reasons You Are Not Getting It Right,Lorraine Paige,14-Sep,1887,50,Health
30 Minutes Workout Routine,Lorraine Paige,14-Sep,1846,50,Health
105 Belly Fat Torching Tips and Tricks That Work,Katherine Y. Henderson,14-Sep,1117,50,Health
Basics Of Body Building,Yasin,14-Aug,987,103,Health
"""Reversing Alzheimer's""",G Veurink,14-Jul,845,51,Health
"Erectile Dysfunction (ED) - Causes, symptoms and treatment modalities- ED Cure",Mark,14-Jul,1363,29,Health
Safely Buying Prescription Drugs Online: The Comprehensive Guide,The Canadian Pharmacy,14-Apr,202,27,Health
What Happens Next,National Institute on Aging,14-May,182,20,Health
What Are Knee Problems?,National Institute of Osteoporosis and Bone Health,14-May,347,5,Health
The Teen Brain: Still Under Construction,National Institute of Mental Health,14-Apr,374,10,Health
"Pregnancy, Breastfeeding and Bone Health",National Institute of Osteoporosis and Bone Health,14-Apr,391,3,Health
Post-Traumatic Stress Disorder,National Institute of Health,14-Apr,394,6,Health
Once Is Enough: A Guide to Preventing Future Fractures,National Institute of Oesteoperosis and Bone Healt,14-Apr,101,6,Health
Older Adults and Depression,National Institute of Mental Health,14-Apr,259,8,Health
Current Intelligence Bulletin 65: Occupational Exposure to Carbon Nanotubes and Nanofibers,"Department of Health and Human Services ,",14-Apr,86,184,Health
Current Intelligence Bulletin 66: Derivation of Immediately Dangerous to Life or Health (IDLH) Values,"National Institutes of Health,",14-Apr,67,111,Health
Current Intelligence Bulletin 64: Coal Mine Dust Exposures and Associated Health Outcomes - A Review of Information Publ,National Institute for Occupational Safety and Hea,14-Apr,46,56,Health
Those Who Continue to Smoke: Is Achieving Abstinence Harder and Do We Need to Change Our Interventions?,National Cancer Institute,14-Apr,59,159,Health
"If I Was Skinnier, Would You Love Me More?",Nadejda Corcimar Alexei,14-Apr,450,30,Health
Top 100 Drugs Sales Free e-Book,Bella Moorena,14-Mar,219,47,Health
School Health Guidelines to Promote Healthy Eating and Physical Activity,U.S. Department of Health and Human Services (HHS),14-Feb,402,80,Health
Emerging Infectious Disease,D. Peter Drotman,14-Feb,198,179,Health
Medicare Coverage of Kidney Dialysis and Kidney Transplant Services,U.S. Department of Health and Human Services,14-Feb,94,54,Health
Medicare &  You 2014,U.S. Department of Health and Human Services,14-Feb,139,152,Health
Health Care Benefits Overview 2012,U.S. Department of Veterans Affairs,14-Feb,77,40,Health
Excel Healthcare Group Identifies 2014 Healthcare Needs and Trends,"Kristie Brown, Matthew Caravana, et al",14-Feb,112,53,Health
Quit Smoking or Die,Robert Velarosa,14-Feb,447,42,Health
Keep the Beat Recipes: Deliciously Healthy Family Meals,U.S. Department of Health and Human Services,14-Feb,405,130,Health
Help Yourself to a Healthy Home: Protect Your Children's Health,U.S. Department of Housing and Urban Development,14-Feb,190,60,Health
Cooking for Groups: A Volunteer's Guide to Food Safety,U.S. Department of Agriculture,14-Feb,297,40,Health
Doctor's Appointment Not Required,Terry Clark,14-Jan,1982,91,Health
High Blood Pressure ~ the Silent Killer Exposed in America!,Terry Clark,14-Jan,791,95,Health
"Super Size Me, Please ~ Obesity, What's Making America Fat?",Terry Clark,14-Jan,355,85,Health
Planning for Health Service Support,Department of the Army,14-Jan,99,416,Health
How to Lose Weight & Stay Fit,Arun Kumar,14-Jan,1421,95,Health
How to Stay Fit and Healthy at Any Age 18 - 99 and Have Fun Doing it!,Terry Clark,14-Jan,940,79,Health
How to Quit Smoking Like a Chimney and Live Longer,Terry Clark,14-Jan,240,100,Health
Acne Is Destroying My Life - Help! Alternative vs Treatments,Terry Clark,14-Jan,364,138,Health
"Before You Detox, It's Not What You Think",Terry Clark,13-Dec,1702,108,Health
"Green Tea the New Fountain of Youth, Myth or Truth?",Terry Clark,13-Dec,993,116,Health
High as a Kite,Terry Clark,13-Dec,300,139,Health
The Pregnant Women,Terry Clark,13-Dec,893,104,Health
Reshaping Agriculture for Nutrition and Health,Shenggen Fan and Rajul Pandya-Lorch,13-Dec,318,230,Health
Just Juice it,Andrea Lambert,13-Nov,1326,27,Health
Cupping: A Prophetic Medicine Appears in its New Scientific Perspective,Mohammad Amin Sheikho,13-Nov,613,93,Health
World's Greatest Health & Exercise Myths,Russell Eaton,13-Oct,2201,38,Health
"Aromatherapy, Essential Wisdom",Reinvent Time,13-Oct,2085,35,Health
The Electronic Cigarette - a User Guide,Halo E-cigarettes,13-Oct,298,38,Health
Super Fruit Handbook,Andy LaPointe,13-Oct,1162,99,Health
Good Health at Low Cost 25 Years On.  What Makes a Successful Health System?,"Dina Balabanova, Martin McKee, et al",13-Oct,682,579,Health
Sleep Like a Pro,Mohammad Kassem,13-Sep,827,50,Health
Heartaches,Vincent Strangio,13-Jul,313,64,Health
25 Ways to Lose 25 Pounds,Vitfix,13-Jul,3489,55,Health
52 Health & Lifestyle Tips,Benjamin Martin,13-Jul,919,30,Health
101 Everyday Power Tips for Preventing (And Treating) Headaches,George Pluss,13-Jul,1371,61,Health
Internal Medicine Practice Questions,Knowmedge,13-Jul,1860,183,Health
How to Eliminate Stress And Anxiety From Your Life,Ethan Chong,13-Jun,1713,77,Health
Ignite Your Metabolism,Hoopes,13-Jun,1075,40,Health
Gluten Freedom,Tammy Scherck,13-May,1378,53,Health
Eating for Energy not for Your Taste Buds,Tom,13-Apr,1527,52,Health
Physiotherapy Exercises,Chandrashekar Belludi,13-Apr,2749,585,Health
"Me vs Myself, On & Off the Court",Dennis Simsek,13-Jan,362,50,Health
Case Notes From a Family Doctor,Ken Kee,13-Jan,1111,46,Health
A Lifestyle to Lose Weight,Joey Vurley,12-Dec,791,39,Health
The Advantages Of Being A Vegetarian,Abdelrhman,12-Dec,1043,103,Health
A Complete Handbook of Nature Cure,Shri Bakhru,12-Nov,12356,50,Health
What Happened to my Allergies?,Dave Drew,12-Oct,928,46,Health
Hemorrhoid & IBS Free - Stop Colorectal Problems for Life,Healthy Symptoms,12-Oct,1720,57,Health
Natural Remedies for Joint Pain Arthritis & Inflammation,Dr. James Meschino,12-Sep,2250,40,Health
"Seven Steps to a Healthy, Fit, Age - Resistant Body",Dr. James Meschino,12-Sep,1090,296,Health
Vibrant Vitality - Harness The Secret Energy Within,Chris D'Cruz,12-Sep,1315,53,Health
How I Cured My Life Long Candida Infection Accidentally,Marvin Lee Robey,12-Sep,2139,93,Health
Acne Secrets,Brett Thompson,12-Aug,2221,41,Health
Comphensive Guide to Accessory Nutrients and Essential Oils,Dr. James Meschino,12-Aug,3668,118,Health
The Complete Guide to Migraine Headaches,Alice Peart,12-Sep,1062,50,Health
Living With Multiple Sclerosis,Piet Mesmer,12-Sep,1433,50,Health
Understanding Incontinence,G. Fairweather,12-Sep,768,50,Health
Freedom From Smoking,Patricia Krenik,12-Aug,823,50,Health
The Complete Guide to Eczema and Psoriasis,Robert Ashe,12-Aug,1576,50,Health
Your Guide to Deep Vein Thrombosis,Marcie Hoff,12-Aug,701,50,Health
Dealing with Prostate Cancer,Norman Falconer,12-Aug,1050,50,Health
Depression: A Misunderstood Disease,Stephanie Mallet,12-Aug,3214,50,Health
De - Mystifying Cancer,Stuart Wolfe,12-Aug,1362,50,Health
Living With Crohn's Disease,Lois Fordham,12-Aug,876,50,Health
Your Guide to Colon Cleansing,Peter Mason,12-Aug,1417,50,Health
Natural Medicine,Dr. Jerry Lee Hoover N.D.,12-Aug,7694,182,Health
Everything you Ever Wanted to Know About Chronic Headaches,Douglas Hanna,12-Aug,889,50,Health
Your Guide to Better Sleep,Neville Amis,12-Aug,1233,50,Health
BioLiving in a High-Tech World,Allie Dawson,12-Aug,1484,50,Health
The Complete Guide to Treating  & Coping With Alzheimer's Disease,Tim Wormald,12-Aug,1369,50,Health
Taking Control of Alcohol,Claire Nash,12-Aug,1006,50,Health
"The Complete Guide to Acne Prevention, Treatment and Remedies!",Pamela Archer,12-Aug,1272,50,Health
Comprehensive Guide to Herbs,Dr. James Meschino,12-Aug,3250,197,Health
The Best E-Cigarette Reviews,Alexa Van Klemp,12-Jul,147,23,Health
100 Weight Loss Tips,Sue Shi,12-Jul,8985,18,Health
Comprehensive Guide to Minerals,Dr. James Meschino,12-Jul,1117,62,Health
Your Guide to Treating Fibromyalgia,Terry Springer,12-Jun,2908,85,Health
Comprehensive Guide to Vitamins,Dr. James Meschino,12-Jun,3117,90,Health
Treatment of Sleep Apnea,Dalyn Baker,12-May,1972,49,Health
They Are Trying to Kill Us and It's Time to Fight Back,Bonnie Wills,12-Apr,3570,165,Health
Health Messages for Afghan Health Care Workers,Group of Authors,12-Apr,118,222,Health
Collection of Articles Dr. Jawad Mofleh,Dr. Mir Jawad Ahmad Mofleh,12-Apr,106,37,Health
Avian Influenza Toolkit-Afghanistan 2007,Edited by: Dr. Mir Jawad Ahmad Mofleh,12-Apr,69,62,Health
Surveillance of Infleuza H1N1-in Afghanistan,Edited by: Dr. Mir Jawad Ahmad Mofleh,12-Apr,51,29,Health
Afghanistan Diseases Early Warning System (DEWS) Manual 2006,Edited by: Dr. Mir Jawad Ahmad Mofleh,12-Apr,670,71,Health
Poliomyelitis for Afghan Health Worker-2005,Dr. Mir Jawad Ahmad Mofleh,12-Apr,329,62,Health
30 Days to a Sexier You! A Self Help Guide for Women Suffering from Low Libido,"Linda L. Ryan, RN",12-Mar,15578,50,Health
The Foundations of Good Health,Lois Francis,12-Feb,615,50,Health
Conquer Your Migraines,Marcelo Muszalski,12-Jan,1620,31,Health
"Think, Act., Love, Lose Weight",Shane Jeremy James,12-Jan,7291,50,Health
Effective Herbal Products for Common Diseases/TCM Health-care Regulation Program,Fumin Tang,12-Jan,3740,61,Health
Turn Your Back on Nicotine,Richard Mcgough,11-Dec,896,29,Health
The Guide to Staying Healthy - By Utterly Frank,Utterly Frank,11-Dec,1246,61,Health
Detox to Lose Weight by Christmas,Ceci Lopez,11-Nov,3418,29,Health
By-Pass Your Cravings to Stop Smoking,Richard Mcgough,11-Nov,2030,24,Health
Secrets to Getting Pregnant Naturally and Easily,Alice Johnson,11-Nov,3553,34,Health
Diabetes and You,Novo Nordisk,11-Sep,4031,50,Health
A Simple Plan to Create the New You,Jim Cooper,11-Sep,13520,88,Health
Taller Para Prevención del Sida Para Hombres Latinos,Jacobo Schifter,11-Aug,1070,200,Health
Manual Para Prevencion Sida en Cárceles,Jacobo Schifter,11-Aug,1018,184,Health
How to Improve Your Posture in 30 Days,Vince Delmonte,11-Jul,3305,50,Health
SuperFoods: Nutritional Powerhouses for Lifelong Health and Vitality,C. Stewart,11-Jul,6413,24,Health
A Guide on Weight Loss - Lose Weight the Correct Way,Jason Squires,11-Jul,10566,20,Health
How to Stay Slim One Bite at a Time,Sonia Hansberry,11-Jun,1127,50,Health
Stop this Pain in my Brain,Rich Allyn,11-Jun,1832,115,Health
Glycemic 101: How to Effortlessly Control Your Blood Sugar For the Rest of Your Life!,Amy,11-May,4627,35,Health
20 Eating Disorder Recovery Questions and Answers,Nina V.,11-May,5512,25,Health
Lowering Your Cholesterol Naturally: Learn How to Get Started Lowering Your Cholesterol Naturally Today,Amy Austen,11-Apr,3700,31,Health
The Winter Wellness Diet: How to Use the Cold to Fire up Your Metabolism and Melt the Fat Away!,Russ Marchewka,11-Apr,3364,59,Health
Islamic Spiritual Intervention(ISI) for Heroin Dependence Treatment,"Dr. Rusdi Abd Rashid, Professor Dr. Hussain Habil",11-Mar,2618,66,Health
How to Reduce Everyday Pain and Inflammation in Your Body!,"Todd M. Cambio, CSCS",11-Feb,10671,30,Health
Penetrate the Soul with a Kiss,Tracy Montgomery,11-Feb,13832,65,Health
Jesus: The Final Journey,Robert E. Macklin,11-Feb,6481,233,Health
Kickbutt Metabolism - The Truth about Permanent fat Loss,David Cassell,11-Feb,5208,38,Health
A Pain in the Back and How to Get Rid of it,Dave Tishendorf,11-Jan,14193,44,Health
Migraines-Defeating the Pain,Jamie Kochan,11-Jan,3690,46,Health
How to Maximize Your Health in the 21st Century,Dr. Isaac Jones,11-Jan,6179,40,Health
Pregnancy Signs,Tania Tod,10-Dec,6121,50,Health
How to Stop Smoking,Mike Reeves-McMillan,10-Dec,2922,18,Health
HGH Fact vs Fiction,Amy Wells,10-Dec,2961,44,Health
Stress Management - How to Break Free from a Stressful Lifestyle,Nelmsc,10-Dec,12161,55,Health
The Utimate Guide to Fast Fitness & Mind Blowing Weight Loss,Susan Jones,10-Sep,9621,50,Health
The Essiac Handbook,Larry Rideout,10-Sep,6333,21,Health
Your Anxious Brain: Freedom From Anxiety and Panic Attacks,Rich Presta,10-Sep,16144,46,Health
Vibrant Living,Fred G. Thompson,10-Sep,15535,112,Health
How to Boost Your Metabolism,Author,10-Aug,17607,63,Health
Where Does it Hurt?,Terry O'Brien,10-Aug,6490,30,Health
Healthy Mind Weight Loss,Martin Wales,10-Aug,21739,23,Health
Quit Smoking Right Now,Author,10-Aug,6446,36,Health
Weight for Me! A Guide to Your Health & Well-Being,Simon Younes,10-Aug,4601,26,Health
Never Get on Another Diet Again!,Karen L. Lugay,10-Aug,4428,50,Health
Beyond the Limits of Myasthenia Gravis,Clete Gress,10-Aug,7701,64,Health
Natural Acne Solution: How to Break Free from Acne and Reclaim Your Life,Seppo Puusa,10-Aug,17840,52,Health
Three Quick Ways to Lose Your Junk in the Trunk and Save Money at the Same Time!,Fit Into Your Jeans,10-Aug,2339,5,Health
Heal Your Headaches Through Your Diet,Sandra Kim Leong,10-Aug,6447,11,Health
A Handbook on Advanced Laser Clinics,Namrita,10-Aug,6773,9,Health
Quit Marijuana Now,Peter Hill,10-Aug,3426,23,Health
The Secret of a Relaxed Neck Unveiled,Sieto Reitsma,10-Aug,7867,42,Health
A Short Guide to Clinical Digital Photography in Orthodontics,Dr. Shadi Samawi,10-Aug,4783,50,Health
Men's Secret Health Issues,Nick Mutt,10-Aug,12028,12,Health
Marijuana and the 7 Secrets,Francis Taylor,10-Aug,10190,26,Health
Getting to Know Anxiety - A Self-Help Guide,Stephanie,10-Aug,7994,21,Health
365 Tips for Healthy Living,Joseph Then,10-Aug,70263,137,Health
"Dandruff, Constipation, and Chronic - Fatigue Syndrome (Homeopathic Treatment)",Dr. Yamin Memon,10-Aug,20084,46,Health
"The Truth Behind the ""Big Lies"" About Chocolate",Dr. Steven E. Warren,10-Aug,5157,28,Health
Arthritis - A Friendly Chat,Sandra Firman,10-Aug,7428,21,Health
Disease & Illness - The Truth Revealed & the Lies Unveiled,The Health Warrior,10-Aug,12128,26,Health
Stop Headache Pressure Point Program,Matthew Scott,10-Aug,6318,12,Health
Your Simple Guide to Aromatherapy,Dr. R.J. Peters & Tamar Goldstein,10-Aug,12612,30,Health
Inside Secrets the Fat Loss Industry Does not Want you to Know,Dan Clay,10-Aug,8442,22,Health
Relaxation - a Path to Healing,Gordon Rosenberg,10-Aug,16688,50,Health
"Seven (7) Secrets That Slim, Toned People Take for Granted",Christine Sutherland,10-Aug,5946,14,Health
The Billion Dollar Hoax,Chris Brisson,10-Aug,4871,19,Health
The Amazing Super Powers of Blue Water,Simon Templeton,10-Aug,8170,19,Health
The  Cancer Terminator  Part II: True-to-Life Stories of 100 Cancer Survivors,Wang Zhen Guo,10-Aug,10008,283,Health
How to Get Sexy Six-Pack Abs,Peter Lawrence,10-Aug,10585,7,Health
The Straight Diet,Ken Bendor,10-Aug,5714,13,Health
43 Nutrition Secrets Revealed,www.savvy-fat-burning-food.com,10-Aug,33327,57,Health
Complete Body Detox Guide to Better Health,Chris Leung,10-Aug,23445,77,Health
How to Get Rid of Anxiety Attacks,Thomas Bredman,10-Aug,11719,16,Health
The Weight Loss Manual,Jon Rutledge,10-Aug,9597,62,Health
"Health for Life - Cure Diabetes, Hypertension, More",Jeff Keto,10-Aug,24666,52,Health
The Low-Down on Cholesterol,Dr. Joseph Mercola,10-Jul,3846,18,Health
Training & Nutrition Insider Secrets for a Lean Body,Mike Geary,10-Jun,55478,66,Health
How to Secretly Boost Your Metabolism,Your Personal Dietitian,10-Jun,17061,63,Health
Fantastic New You! An Introductory Guide to Achieving an Astonishing Transformation in Your Weight and Appearance,Mark Ellison,10-May,32504,190,Health
The Guide to Staying Healthy,Layla,10-Mar,5921,39,Health
Slimming Solved,Lea Davies,10-Jan,3116,22,Health
The 7 Secrets,Gwuido65,10-Jan,8087,22,Health
The 10 Biggest Fat Loss Lies,Anthony Alayon,9-Dec,8193,34,Health
10 Great Ways to Self-Esteem,James Vanstone,9-Nov,55125,14,Health
The Natural Remedy Handbook,Simon Goodall,9-Nov,19163,50,Health
Natural Anti-Aging Tips,Lambert Klein,9-Oct,13727,22,Health
Endometriosis,Kyle Norton,9-Oct,9280,150,Health
Overcome Infertility - How to get Pregnant Naturally,Kyle Norton,9-Oct,18339,190,Health
I Did It! So Can You!,Dan McNeil,9-Sep,6344,24,Health
Holistic and Alternative Medicine-101 Natural Health Tips,Jonathan Callinan,9-Sep,18129,22,Health
Cultural Rehydration: A Layman’s Guide to Dealing with Culture Shock,Dr. Gerald W. Anthony,9-Sep,5075,47,Health
"The Truth About Nutrition, Weight Loss and Weight Loss Supplements",Martin Bolduc,9-Aug,6937,53,Health
World's Best Health Cookbook,Allen Lewis,9-Aug,10508,50,Health
Room 9,Clifford Beck,26-Mar,0,178,Fiction
I am the grim reaper,D.A.Sanford,26-Mar,0,29,Fiction
Black Sun,Clifford Beck,26-Mar,0,282,Fiction
Be Like a Tree Planted by the Water In the Sunshine,Linda L. Linn,26-Mar,1,205,Fiction
Return to Me,Ericka Clay,26-Mar,5,62,Fiction
The Gatherings,D.A.Sanford,26-Mar,8,51,Fiction
Welcome to my world,D.A.Sanford,26-Feb,15,55,Fiction
I am the book keeper,D.A.Sanford,26-Jan,8,43,Fiction
The Road Less Traveled,D.A.Sanford,26-Jan,26,26,Fiction
Lost in thought,D.A.Sanford,25-Dec,47,63,Fiction
THE KOSTROMA SAGA,Michel Poulin,25-Dec,56,1032,Fiction
My journal for my kittens,D.A.Sanford,25-Dec,10,59,Fiction
THE LONE WOLF (2025 Edition),Michel Poulin,25-Nov,86,486,Fiction
Your Dream Campground,D.A.Sanford,25-Nov,7,24,Fiction
Don't Mess with Me,D.A.Sanford,25-Nov,20,30,Fiction
Assassin,D.A.Sanford,25-Oct,54,55,Fiction
My nymph wife,D.A.Sanford,25-Oct,25,33,Fiction
TEMPORAL AGENT,Michel Poulin,25-Sep,179,769,Fiction
"Population: One, Me",D.A.Sanford,25-Sep,54,32,Fiction
Elves' Insurection,D.A.Sanford,25-Sep,21,29,Fiction
A girls red notebook compelation 2025 version,D.A.Sanford,25-Aug,18,104,Fiction
CHILDREN OF TIME (2025 Edition),Michel Poulin,25-Aug,125,680,Fiction
ADVENTURES THROUGH TIME (2025 Edition),Michel Poulin,25-Aug,152,913,Fiction
Chris and The Three Wizards,D.A.Sanford,25-Aug,22,35,Fiction
Junkman is Awake,D.A.Sanford,25-Aug,51,48,Fiction
She Was A Blond,D.A.Sanford,25-Jul,38,36,Fiction
From Disaster Comes Good,D.A.Sanford,25-Jul,33,45,Fiction
CODENAME: ATHENA (2025 Edition),Michel Poulin,25-Jul,203,664,Fiction
Dilemma,D.A.Sanford,25-Jul,19,27,Fiction
The Electronic Commandos,D.A.Sanford,25-Jun,18,37,Fiction
Finding just who is my family,D.A.Sanford,25-Jun,26,23,Fiction
The Time Harvester,D.A.Sanford,25-May,42,41,Fiction
A reunion of worlds,D.A.Sanford,25-May,23,82,Fiction
Love in the air,Vatsal Bhargava,25-Jun,48,366,Fiction
The Roadside Psalmist,Pastor Vinod sk,25-Jun,7,33,Fiction
Descendants of Aliens Living on the Blue Planet,Kwayland,25-Jun,47,89,Fiction
Dissenting Opinion,Stephen Byrd,25-Jun,26,195,Fiction
INGRID DOWS - AN ALTERNATE STORY PART 3 - THE SPACE AGE,Michel Poulin,25-Jun,168,358,Fiction
The Masten Legacy,Samuel Masten,25-Jun,7,55,Fiction
The Hard Road,D.A.Sanford,1-Dec,45,50,Fiction
Conversations With AI - Book Four,Julio Carrancho,25-Feb,116,468,Fiction
Anthology Complex VIII,M.B. Julien,25-Feb,27,189,Fiction
World's Cleanup Crew,D.A.Sanford,25-Feb,73,58,Fiction
Conversations With AI - Book Three,Julio Carrancho,25-Feb,66,492,Fiction
Silverwood Manor,Stephen Byrd,25-Feb,73,192,Fiction
Elrick's Journey,D.A.Sanford,25-Feb,18,34,Fiction
"History of the Changelings Billy Barker, Zorn, Brad Jenkens",D.A.Sanford,25-Feb,20,220,Fiction
Indian People are Descendants of Aliens from Mars,Kwayland,25-Jan,32,89,Fiction
The Adventure of a Lifetime,D.A.Sanford,25-Jan,23,74,Fiction
My two cats take me to my nexr world trilogy plus related stories,D.A. Sanford,25-Jan,24,273,Fiction
"The Dancing Man, Redemption and Shifters",D.A. Sanford,25-Jan,23,58,Fiction
Happily Ever After. Not Tales of the Unfortunate,D.A. Sanford,24-Dec,28,24,Fiction
"Wizards, Swords, And Hoverboards",Pete Bertino,24-Dec,47,109,Fiction
Waiting for the end and two  others,D.A. Sanford,24-Dec,37,57,Fiction
Anthology Complex VII,M.B. Julien,24-Dec,8,190,Fiction
Anthology Complex VI,M.B. Julien,24-Dec,8,239,Fiction
Anthology Complex V,M.B. Julien,24-Dec,6,252,Fiction
Anthology Complex IV,M.B. Julien,24-Dec,7,236,Fiction
Anthology Complex III,M.B. Julien,24-Dec,11,183,Fiction
Anthology Complex II,M.B. Julien,24-Dec,13,198,Fiction
The Pitcairn Perspectives,Philip Spires,24-Dec,26,304,Fiction
The Sage plus two others,D.A. Sanford,24-Dec,28,58,Fiction
Time has cast me out plus four more stories,D.A. Sanford,24-Nov,31,82,Fiction
Stranded,D.A. Sanford,24-Nov,58,27,Fiction
A Flock Leaders Journey,D.A. Sanford,24-Nov,29,82,Fiction
Them and Us,Paul Schueller,24-Oct,51,49,Fiction
The Reincarnated Dragon Slayer,D.A. Sanford,24-Oct,34,70,Fiction
NOSTROMO IN SPACE AND TIME,Michel Poulin,24-Oct,382,169,Fiction
The World of Tom Stafford,D.A. Sanford,24-Oct,75,125,Fiction
From the complaint department to the emperor of a planet,D.A. Sanford,24-Sep,42,60,Fiction
My cats take me to the next world book 3,D.A. Sanford,24-Sep,32,49,Fiction
My cats take me to the next world book 2,D.A. Sanford,24-Sep,26,107,Fiction
My Cats Take Me To The Next World -  Book 1,D.A. Sanford,24-Sep,41,129,Fiction
The Demons Daughter,D.A. Sanford,24-Sep,55,132,Fiction
Surviving The Virus,D.A. Sanford,24-Sep,70,155,Fiction
The Lost Way To Misrost,Ehab Shawky,24-Sep,47,451,Fiction
Song of the solitary left eye tear drop,Paul Njabulo Vilakazi,24-Sep,18,120,Fiction
The Zenya Bernard Story,Ausin Mitchell,24-Aug,22,23,Fiction
Sleepless Nights in the Hills,Ausin Mitchell,24-Aug,21,20,Fiction
Games Lovers Play,Ausin Mitchell,24-Aug,15,22,Fiction
The Night Lovers,Ausin Mitchell,24-Aug,14,20,Fiction
Cheating Lovers,Ausin Mitchell,24-Aug,11,128,Fiction
Daytime Lovers,Ausin Mitchell,24-Aug,12,24,Fiction
Backwood Lovers,Ausin Mitchell,24-Aug,5,24,Fiction
Yinzer Yarnz,Mike Bozart,24-Aug,17,78,Fiction
Atlantic Canada Tales,Mike Bozart,24-Aug,20,45,Fiction
Strange Tales From South Philly: An Anthology,Pete Bertino,24-Jul,20,309,Fiction
INGRID DOWS - AN ALTERNATE STORY PART 2 - THE JET AGE,Michel Poulin,24-Jul,318,323,Fiction
Echoes of Retribution,D Delisser Books,24-Apr,130,50,Fiction
The Greenhouse,Steven Bowman and Katie Christy,24-Apr,39,76,Fiction
The Final Confrontation: Wizard Of Shadows,Hussnain Ahmad,24-Apr,54,32,Fiction
FEMALE FIGHTER PILOT - INGRID DOWS - AN ALTERNATE STORY,Michel Poulin,24-Apr,366,679,Fiction
PATRIDA: A NOVEL OF THE PANKRATION,PETER K KATSIONIS,24-Mar,82,383,Fiction
Fairy-Tech Academy: Where magic meets machinery,Zayd Thornton,24-Mar,269,121,Fiction
IN THE ARMS OF A SOLDIER,BUDDHABHUSHAN KUCHEKAR,24-Mar,72,244,Fiction
Chaucer's Revenge,Robby Richardson,24-Mar,71,228,Fiction
Choice,david m. giosa,24-Feb,25,25,Fiction
The Tale of Nam-Thy,Hipno Amadeus,24-Feb,16,26,Fiction
NOSTROMO - LOST IN TIME,Michel Poulin,24-Jan,599,225,Fiction
Witch's Grave,J Bennington,24-Jan,140,80,Fiction
